{
  "schema_version": "0.1.0-draft",
  "plan_id": "PLAN-MOCK-001",
  "scenario_id": "SCN-MOCK-001",
  "snapshot_id": "SNAP-MOCK-001",
  "scenario_state_version": 1,
  "data_origin": "mock",
  "objective": "time",
  "solver_status": "UNKNOWN",
  "has_validated_plan": false,
  "model_scope": [],
  "metrics": {
    "last_delivery_s": 500,
    "makespan_s": 900,
    "energy_kwh": null,
    "cost_cny": null,
    "sortie_count": 1,
    "unserved_demand_count": 0,
    "mandatory_served_count": 1,
    "mandatory_total_count": 1,
    "min_return_soc": null
  },
  "sorties": [
    {
      "sortie_id": "SORTIE-MOCK-001",
      "kind": "transport",
      "drone_id": "U01",
      "battery_id": "BAT01",
      "cargo_ids": [
        "BOX01"
      ],
      "visits": [
        {
          "site_id": "S01",
          "cargo_ids": [
            "BOX01"
          ],
          "delivery_complete_s": 500
        }
      ],
      "route_geometry": {
        "type": "LineString",
        "coordinates": [
          [
            108.9,
            22.9
          ],
          [
            108.91,
            22.91
          ],
          [
            108.9,
            22.9
          ]
        ]
      },
      "prepare_start_s": 0,
      "takeoff_s": 60,
      "return_s": 900,
      "drone_released_s": 930,
      "battery_released_s": 1200,
      "energy_kwh": null,
      "return_soc": null,
      "terrain_status": "not_evaluated",
      "communication_status": "not_evaluated"
    }
  ],
  "unserved_demand_ids": [],
  "validation": {
    "status": "not_run",
    "checks": []
  },
  "generated_at": "2026-10-17T09:00:00+08:00",
  "solver_notes": [
    "人工绘制的开发占位安排，时间不是算法结果；不得确认或用作性能证据。"
  ],
  "parent_plan_id": null,
  "event_id": null,
  "change_summary": null
}
